Conjunto,Comentarios,CAV
Ropa de trabajo,La ropa de trabajo fabricada con un tejido es el conjunto de referencia.,0
Overol de trabajo de tela,Tejido que incluye algodón tratado,0
Overol de trabajo de SMS (Tela de polietileno) no tejido en una sola capa,Proceso no patentado para fabricar telas no tejidas de polipropileno,0
Overol de trabajo no tejido de poliolefina en una sola capa,Un tejido propio fabricado con polietileno,2
Delantal de barrera de vapor con mangas largas y largo sobre overol de tela,La configuración del delantal envolvente fue diseñada para proteger la parte delantera y los lados del cuerpo contra los derrames de agentes químicos,4
Doble capa de ropa tejida,Generalmente se considera un overol de trabajo sobre la ropa de trabajo,3
Overol de trabajo con barrera de vapor como capa única sin capucha,El efecto real depende del nivel de humedad y en muchos casos el efecto es menor,10
Overol con barrera de vapor y capucha como capa única,El efecto real depende del nivel de humedad u en muchos casos el efecto es menor,11
Overol de trabajo con barrera de vapor sobre mono de tela sin capucha,"-",12

